{"id":"canonical-pdf.pdfjs.v1","identity":{"reference_profile_digest":"sha256:1e08a342359ac1c7eed1384b8e027a8289257b46bdccbbad3a9980e786136b71","upstream_commit":"6353acefe5007cd4899247a8c4e83cb7c9435a54","upstream_version":"6.1.200","viewer":"pdfjs"},"implementation":{"artifacts":[{"name":"canonical Node and Linux runtime container","sha256":"111dde95859f2c659291cb60e698f9048a8fc30b35b4ddb7c90f9cb5b73062d9","url":"https://mcr.microsoft.com/v2/playwright/manifests/sha256:111dde95859f2c659291cb60e698f9048a8fc30b35b4ddb7c90f9cb5b73062d9"}],"features":["pdfjs legacy generic build","@napi-rs/canvas getImageData","built-in path font renderer"],"forbidden_features":["system-fonts","font-face-loading","forms","annotations","XFA","WASM","HWA","network","range-loading","stream-loading","shared-worker-state"],"lockfile":{"path":"tools/pdf-harness/pdfjs/package-lock.json","sha256":"887c2194fe05e87250486f4e6c8da341d0fb51748e14c3b4cf94a16455740c60"},"sources":[{"path":"tools/pdf-harness/pdfjs/render.mjs","sha256":"f050acbfed7a7d8ee32de56c2013cc14eeacad4352962911943587d1ae6883f0"},{"path":"tools/pdf-harness/run-pdfjs.sh","sha256":"a944fd3b5e3e09daca96d372341585b3b17442b3421bf7697eb865d1abc8d82e"},{"path":"tools/pdf-harness/install.sh","sha256":"807ed0cf4c5bd78d92fba42b1195b4d594075ec31e7138814afc9422db06f87c"},{"path":"tools/pdf-harness/pdfjs/package.json","sha256":"47568c38acfd50bbdc8dca6ee4afbd3e58e16fa7c10d8afcb18efa7f19fbbb89"}]},"qualification":{"case_id":"focused.rectangle-outline.v1","dpi":96,"restrictions":["Project-authored calibration control only; not renderer PDF evidence","Valid control uses PDF vectors only and contains no image XObject","Later renderer candidates must pass this profile without calibration overlays"]},"runtime":[{"name":"pdfjs-dist","value":"6.1.200 at 6353acefe5007cd4899247a8c4e83cb7c9435a54"},{"name":"@napi-rs/canvas","value":"1.0.2 Linux x64 GNU Skia backend"},{"name":"node","value":"24.16.0"},{"name":"npm","value":"11.13.0"},{"name":"container","value":"mcr.microsoft.com/playwright@sha256:111dde95859f2c659291cb60e698f9048a8fc30b35b4ddb7c90f9cb5b73062d9, linux/amd64"}],"schema":{"id":"excalidraw-render/conformance-pdf-viewer-profile/v1","path":"tests/conformance/pdf-viewer-profile-v1.schema.json","sha256":"ed0bc5716e15ffe5abad11be28a3deb575146352a05db28d84bef11487d5dc71"},"settings":{"color":{"alpha":"getImageData straight alpha; zero RGB below zero alpha","canvas":"transparent RGBA canvas","space":"Skia canvas output normalized to straight-alpha sRGB RGBA8"},"dimensions":{"dpi":"96","expected_output":"caller-supplied exact dimensions; 200x120 for qualification","page_selection":"exactly one page with rotation 0 and UserUnit 1","pdf_points_per_pixel":"0.75","rounding":"viewport dimensions must already be integral; exact 200x120 qualification output","scale":"binary64 96/72"},"errors":{"dimensions":"multi-page, rotated, UserUnit, or fractional-dimension controls are rejected","render":"load, operator-list, and render failures are fatal","stop_at_errors":"true","verbosity":"errors only"},"fonts":{"disable_font_face":"true","embedded_fonts":"PDF.js built-in path rendering only","standard_font_data":"none","use_system_fonts":"false"},"rendering":{"HWA":"false","WASM":"false","XFA":"false","annotations":"AnnotationMode.DISABLE","background":"rgba(0,0,0,0)","intent":"display","stop_at_errors":"true"},"resources":{"CMaps_ICC_WASM_standard_fonts":"no external URLs","auto_fetch":"disabled","input":"in-memory Uint8Array","network":"container network none","range":"disabled","stream":"disabled"},"state":{"container":"fresh network-disabled invocation","process":"fresh Node process and PDF worker per render","sharing":"no worker, document, canvas, font, cache, clock, or viewer state shared between roles"}}}
